{
  "contract": "crdd/reality-symbol-manifest",
  "contractRevision": 1,
  "subsystem": "project-operation",
  "symbols": [
    {
      "symbolId": "project-operation.public-api",
      "kind": "module",
      "path": "src/index.ts",
      "archIds": ["ARCH-000005", "ARCH-000016"]
    },
    {
      "symbolId": "project-operation.domain.project-projection",
      "kind": "file",
      "path": "src/project-operation.ts",
      "archIds": ["ARCH-000005", "ARCH-000016"]
    },
    {
      "symbolId": "project-operation.domain.repository-project-context",
      "kind": "file",
      "path": "src/repository-project-context.ts",
      "archIds": ["ARCH-000005"]
    },
    {
      "symbolId": "project-operation.domain.repository-release-projection",
      "kind": "file",
      "path": "src/repository-release-projection.ts",
      "archIds": ["ARCH-000005"]
    },
    {
      "symbolId": "project-operation.domain.repository-quality-projection",
      "kind": "file",
      "path": "src/repository-quality-projection.ts",
      "archIds": ["ARCH-000005"]
    },
    {
      "symbolId": "project-operation.domain.topic-meeting-record",
      "kind": "file",
      "path": "src/topic-meeting.ts",
      "archIds": ["ARCH-000006"]
    },
    {
      "symbolId": "project-operation.repository.topic-meeting",
      "kind": "file",
      "path": "src/topic-meeting-repository.ts",
      "archIds": ["ARCH-000006"]
    },
    {
      "symbolId": "project-operation.application.topic-meeting",
      "kind": "file",
      "path": "src/topic-meeting-application.ts",
      "archIds": ["ARCH-000006"]
    },
    {
      "symbolId": "project-operation.domain.candidate-lifecycle",
      "kind": "file",
      "path": "src/project-operation.ts",
      "archIds": ["ARCH-000016"]
    },
    {
      "symbolId": "project-operation.test.integration.project-projection",
      "kind": "test-suite",
      "path": "tests/integration/project-projection.contract.test.ts",
      "qaIds": ["QA-000004"],
      "localTestIds": ["PPR-IT-002"],
      "verifies": ["project-operation.domain.project-projection"]
    },
    {
      "symbolId": "project-operation.test.integration.repository-project-context",
      "kind": "test-suite",
      "path": "tests/integration/repository-project-context.contract.test.ts",
      "qaIds": ["QA-000004"],
      "localTestIds": ["PPR-IT-019"],
      "verifies": [
        "project-operation.domain.repository-project-context",
        "project-operation.domain.repository-release-projection",
        "project-operation.domain.repository-quality-projection"
      ]
    },
    {
      "symbolId": "project-operation.test.integration.topic-meeting-record",
      "kind": "test-suite",
      "path": "tests/integration/topic-meeting-record.contract.test.ts",
      "qaIds": ["QA-000005"],
      "localTestIds": ["CPR-IT-008"],
      "verifies": ["project-operation.domain.topic-meeting-record"]
    },
    {
      "symbolId": "project-operation.test.integration.topic-meeting-repository",
      "kind": "test-suite",
      "path": "tests/integration/topic-meeting-repository.contract.test.ts",
      "qaIds": ["QA-000005"],
      "localTestIds": ["CPR-IT-008"],
      "verifies": [
        "project-operation.domain.topic-meeting-record",
        "project-operation.repository.topic-meeting"
      ]
    },
    {
      "symbolId": "project-operation.test.integration.topic-meeting-application",
      "kind": "test-suite",
      "path": "tests/integration/topic-meeting-application.contract.test.ts",
      "qaIds": ["QA-000005"],
      "localTestIds": ["CPR-IT-008"],
      "verifies": [
        "project-operation.application.topic-meeting",
        "project-operation.repository.topic-meeting"
      ]
    },
    {
      "symbolId": "project-operation.test.integration.candidate-adoption",
      "kind": "test-suite",
      "path": "tests/integration/candidate-adoption.contract.test.ts",
      "qaIds": ["QA-000005"],
      "localTestIds": ["CPR-IT-004", "CPR-IT-006"],
      "verifies": ["project-operation.domain.candidate-lifecycle"]
    }
  ]
}
