{
  "contract": "crdd/reality-symbol-manifest",
  "contractRevision": 1,
  "subsystem": "verification-runner",
  "symbols": [
    {
      "symbolId": "verification-runner.regression-entry",
      "kind": "module",
      "path": "src/index.ts",
      "archIds": [
        "ARCH-000003"
      ]
    },
    {
      "symbolId": "verification-runner.test.integration.regression-runner",
      "kind": "test-suite",
      "path": "tests/integration/regression-runner.contract.test.ts",
      "qaIds": [
        "QA-000001",
        "QA-000002"
      ],
      "localTestIds": [
        "CQS-IT-011",
        "CQS-IT-012",
        "CQS-IT-013",
        "RCM-IT-007"
      ],
      "verifies": [
        "verification-runner.source.src.execution.regression.execution"
      ]
    },
    {
      "symbolId": "verification-runner.test.unit.test-catalog",
      "kind": "test-suite",
      "path": "tests/unit/catalog/inspect.contract.test.ts",
      "qaIds": [
        "QA-000002"
      ],
      "localTestIds": [
        "CQS-UT-010"
      ],
      "verifies": [
        "verification-runner.source.src.catalog.test.catalog"
      ]
    },
    {
      "symbolId": "verification-runner.test.system.resource-intensive-gate",
      "kind": "test-suite",
      "path": "tests/system/resource-intensive-gate.contract.test.ts",
      "qaIds": [
        "QA-000002",
        "QA-000006"
      ],
      "localTestIds": [
        "CQS-ST-012",
        "CQS-ST-013",
        "ERB-ST-015"
      ],
      "verifies": [
        "verification-runner.regression-entry",
        "verification-runner.source.src.execution.regression.execution",
        "verification-runner.source.src.catalog.test.catalog"
      ]
    },
    {
      "symbolId": "verification-runner.source.src.execution.regression.execution",
      "kind": "file",
      "path": "src/regression/stages.ts",
      "archIds": [
        "ARCH-000003"
      ]
    },
    {
      "symbolId": "verification-runner.source.src.catalog.test.catalog",
      "kind": "file",
      "path": "src/catalog/inspect.ts",
      "archIds": [
        "ARCH-000003"
      ]
    }
  ]
}
