{
  "contract": "crdd/reality-symbol-manifest",
  "contractRevision": 1,
  "subsystem": "checker",
  "symbols": [
    {
      "symbolId": "checker.public-entry",
      "kind": "module",
      "path": "src/index.ts",
      "archIds": [
        "ARCH-000001",
        "ARCH-000002",
        "ARCH-000008"
      ]
    },
    {
      "symbolId": "checker.artifact-relation-adapter",
      "kind": "module",
      "path": "src/findings/artifact-issues.ts",
      "archIds": [
        "ARCH-000001",
        "ARCH-000002"
      ]
    },
    {
      "symbolId": "checker.pipeline",
      "kind": "module",
      "path": "src/inspection/pipeline.ts",
      "archIds": [
        "ARCH-000001",
        "ARCH-000002"
      ]
    },
    {
      "symbolId": "checker.finding-model",
      "kind": "module",
      "path": "src/findings/collector.ts",
      "archIds": [
        "ARCH-000001"
      ]
    },
    {
      "symbolId": "checker.rule-registry",
      "kind": "module",
      "path": "src/rules/registry.ts",
      "archIds": [
        "ARCH-000001",
        "ARCH-000002"
      ]
    },
    {
      "symbolId": "checker.current-profile",
      "kind": "module",
      "path": "src/rules/current-profile.ts",
      "archIds": [
        "ARCH-000001"
      ]
    },
    {
      "symbolId": "checker.quality-design-state-rule",
      "kind": "module",
      "path": "src/rules/quality-design-state.ts",
      "archIds": [
        "ARCH-000001"
      ]
    },
    {
      "symbolId": "checker.reality-symbol-graph-rule",
      "kind": "module",
      "path": "src/rules/reality-symbol-graph.ts",
      "archIds": [
        "ARCH-000001",
        "ARCH-000002"
      ]
    },
    {
      "symbolId": "checker.test.integration.crdd-check",
      "kind": "test-suite",
      "path": "tests/integration/crdd-check.contract.test.ts",
      "qaIds": [
        "QA-000001",
        "QA-000013"
      ],
      "localTestIds": [
        "AUH-IT-002",
        "AUH-IT-003",
        "RCM-IT-005",
        "RCM-IT-008"
      ],
      "verifies": [
        "checker.artifact-relation-adapter",
        "checker.pipeline",
        "checker.rule-registry"
      ]
    },
    {
      "symbolId": "checker.test.integration.tools-naming",
      "kind": "test-suite",
      "path": "tests/integration/tools-naming.contract.test.ts",
      "qaIds": [
        "QA-000001"
      ],
      "localTestIds": [
        "RCM-IT-005",
        "RCM-IT-013",
        "RCM-IT-015"
      ],
      "verifies": [
        "checker.pipeline",
        "checker.public-entry",
        "checker.rule-registry"
      ]
    },
    {
      "symbolId": "checker.test.integration.domain-outcome-adapter",
      "kind": "test-suite",
      "path": "tests/integration/domain-outcome-adapter.contract.test.ts",
      "qaIds": [
        "QA-000001"
      ],
      "localTestIds": [
        "RCM-IT-011"
      ],
      "verifies": [
        "checker.domain-outcome-adapter",
        "checker.source.src.adapters.reality.traceability",
        "crdd-domain-library.common-outcome-entry"
      ]
    },
    {
      "symbolId": "checker.test.unit.checker-core",
      "kind": "test-suite",
      "path": "tests/unit/inspection/pipeline.contract.test.ts",
      "qaIds": [
        "QA-000001"
      ],
      "localTestIds": [
        "RCM-UT-001",
        "RCM-UT-002"
      ],
      "verifies": [
        "checker.finding-model",
        "checker.pipeline"
      ]
    },
    {
      "symbolId": "checker.test.unit.symbol-graph",
      "kind": "test-suite",
      "path": "tests/unit/reality/symbol-graph.contract.test.ts",
      "qaIds": [
        "QA-000004"
      ],
      "localTestIds": [
        "PPR-UT-017"
      ],
      "verifies": [
        "checker.source.src.adapters.reality.test.catalog",
        "checker.source.src.adapters.reality.traceability",
        "crdd-domain-library.source.src.reality.traceability.symbol.manifest.model",
        "version-control.source.src.repository.location"
      ]
    },
    {
      "symbolId": "checker.domain-outcome-adapter",
      "kind": "file",
      "path": "src/findings/domain-outcome.ts",
      "archIds": [
        "ARCH-000001"
      ]
    },
    {
      "symbolId": "checker.source.src.adapters.reality.test.catalog",
      "kind": "file",
      "path": "src/reality/test-catalog.ts",
      "archIds": [
        "ARCH-000001"
      ]
    },
    {
      "symbolId": "checker.source.src.adapters.reality.traceability",
      "kind": "file",
      "path": "src/reality/symbol-traceability.ts",
      "archIds": [
        "ARCH-000001"
      ]
    },
    {
      "symbolId": "semantic-coverage.test.unit.pilot",
      "kind": "test-suite",
      "path": "tests/unit/semantic/coverage.contract.test.ts",
      "qaIds": [
        "QA-000004"
      ],
      "localTestIds": [
        "PPR-UT-016",
        "PPR-UT-017"
      ],
      "verifies": [
        "crdd-domain-library.source.src.reality.traceability.symbol.manifest.validator",
        "crdd-domain-library.source.src.repository.observation.reality.symbol.repository.observer",
        "semantic-coverage.source.src.application.semantic.coverage",
        "semantic-coverage.source.src.compilation.index",
        "semantic-coverage.source.src.migrations.legacy.runtime.inventory",
        "version-control.source.src.repository.location"
      ]
    },
    {
      "symbolId": "semantic-coverage.test.unit.public-boundary",
      "kind": "test-suite",
      "path": "tests/unit/semantic/public-boundary.contract.test.ts",
      "qaIds": [
        "QA-000001"
      ],
      "localTestIds": [
        "RCM-UT-014"
      ],
      "verifies": [
        "semantic-coverage.public-entry"
      ]
    },
    {
      "symbolId": "semantic-coverage.source.src.application.semantic.coverage",
      "kind": "file",
      "path": "src/semantic/inspection.ts",
      "archIds": [
        "ARCH-000008"
      ]
    },
    {
      "symbolId": "semantic-coverage.source.src.migrations.legacy.runtime.inventory",
      "kind": "file",
      "path": "scripts/semantic-legacy-inventory.ts",
      "archIds": [
        "ARCH-000008"
      ]
    },
    {
      "symbolId": "checker.semantic-command",
      "kind": "file",
      "path": "src/semantic/command.ts",
      "archIds": [
        "ARCH-000008"
      ]
    },
    {
      "symbolId": "checker.test.integration.semantic-command",
      "kind": "test-suite",
      "path": "tests/integration/semantic-command.integration.test.ts",
      "qaIds": [
        "QA-000001",
        "QA-000004"
      ],
      "localTestIds": [
        "PPR-IT-018",
        "RCM-IT-005"
      ],
      "verifies": [
        "checker.semantic-command",
        "domain-model.semantic-publish",
        "semantic-coverage.source.src.application.semantic.coverage",
        "semantic-coverage.source.src.infrastructure.filesystem.semantic.bundle.publisher"
      ]
    }
  ]
}
