{
  "contract": "crdd/reality-symbol-manifest",
  "contractRevision": 1,
  "subsystem": "version-control",
  "symbols": [
    {
      "symbolId": "version-control.workspace.observation",
      "kind": "file",
      "path": "src/workspace/observation.ts",
      "archIds": ["ARCH-000002", "ARCH-000013"]
    },
    {
      "symbolId": "version-control.workspace-candidate",
      "kind": "file",
      "path": "src/workspace/candidate.ts",
      "archIds": [
        "ARCH-000009"
      ]
    },
    {
      "symbolId": "version-control.git-worktree-management",
      "kind": "file",
      "path": "src/workspace/worktree.ts",
      "archIds": [
        "ARCH-000009"
      ]
    },
    {
      "symbolId": "version-control.test.integration.worktree-management",
      "kind": "test-suite",
      "path": "tests/integration/worktree-management.integration.test.ts",
      "qaIds": [
        "QA-000007"
      ],
      "localTestIds": [
        "RFD-IT-029"
      ],
      "verifies": [
        "version-control.git-worktree-management",
        "version-control.workspace-candidate",
        "version-control.workspace.observation",
        "version-control.source.src.workspace.merge"
      ]
    },
    {
      "symbolId": "version-control.git-read-command",
      "kind": "file",
      "path": "src/git/read.ts",
      "archIds": [
        "ARCH-000002",
        "ARCH-000009"
      ]
    },
    {
      "symbolId": "version-control.test.integration.git-read-command",
      "kind": "test-suite",
      "path": "tests/integration/git-read-command.integration.test.ts",
      "qaIds": [
        "QA-000007"
      ],
      "localTestIds": [
        "RFD-IT-005",
        "RFD-IT-008"
      ],
      "verifies": [
        "version-control.git-read-command",
        "version-control.git-repository-worktree-view-adapter",
        "version-control.source.src.git.local.change.set.adapter"
      ]
    },
    {
      "symbolId": "version-control.public-api",
      "kind": "module",
      "path": "src/index.ts",
      "archIds": [
        "ARCH-000002",
        "ARCH-000009",
        "ARCH-000014",
        "ARCH-000016"
      ]
    },
    {
      "symbolId": "version-control.change-publication",
      "kind": "file",
      "path": "src/publication/change.ts",
      "archIds": [
        "ARCH-000009"
      ]
    },
    {
      "symbolId": "version-control.git-change-publication-adapter",
      "kind": "file",
      "path": "src/publication/git.ts",
      "archIds": [
        "ARCH-000009"
      ]
    },
    {
      "symbolId": "version-control.repository-worktree-view",
      "kind": "file",
      "path": "src/repository/worktree-view.ts",
      "archIds": [
        "ARCH-000002",
        "ARCH-000009"
      ]
    },
    {
      "symbolId": "version-control.git-repository-worktree-view-adapter",
      "kind": "file",
      "path": "src/repository/worktree-view.ts",
      "archIds": [
        "ARCH-000002",
        "ARCH-000009"
      ]
    },
    {
      "symbolId": "version-control.test.integration.change-publication",
      "kind": "test-suite",
      "path": "tests/integration/change-publication.integration.test.ts",
      "qaIds": [
        "QA-000007"
      ],
      "localTestIds": [
        "RFD-IT-014"
      ],
      "verifies": [
        "version-control.change-publication",
        "version-control.git-change-publication-adapter"
      ]
    },
    {
      "symbolId": "version-control.checker-repository-observation-adapter",
      "kind": "module",
      "path": "src/git/observation.ts",
      "archIds": [
        "ARCH-000002",
        "ARCH-000009",
        "ARCH-000016"
      ]
    },
    {
      "symbolId": "version-control.test.integration.repository-location",
      "kind": "test-suite",
      "path": "tests/integration/repository-location.integration.test.ts",
      "qaIds": [
        "QA-000007"
      ],
      "localTestIds": [
        "RFD-IT-001",
        "RFD-IT-002"
      ],
      "verifies": [
        "version-control.source.src.repository.location"
      ]
    },
    {
      "symbolId": "version-control.test.integration.local-change-set",
      "kind": "test-suite",
      "path": "tests/integration/local-change-set.integration.test.ts",
      "qaIds": [
        "QA-000007"
      ],
      "localTestIds": [
        "RFD-IT-005",
        "RFD-IT-008"
      ],
      "verifies": [
        "version-control.source.src.git.local.change.set.adapter",
        "version-control.source.src.local.change.set",
        "version-control.source.src.repository.location"
      ]
    },
    {
      "symbolId": "version-control.test.integration.repository-worktree-view",
      "kind": "test-suite",
      "path": "tests/integration/repository-worktree-view.integration.test.ts",
      "qaIds": [
        "QA-000007"
      ],
      "localTestIds": [
        "RFD-IT-008"
      ],
      "verifies": [
        "version-control.repository-worktree-view",
        "version-control.git-repository-worktree-view-adapter"
      ]
    },
    {
      "symbolId": "version-control.test.integration.consumer-closure",
      "kind": "test-suite",
      "path": "tests/integration/consumer-closure.integration.test.ts",
      "qaIds": [
        "QA-000001"
      ],
      "localTestIds": [
        "RCM-IT-004"
      ],
      "verifies": [
        "version-control.public-api",
        "version-control.source.src.checker.observation.index",
        "version-control.source.src.repository.location"
      ]
    },
    {
      "symbolId": "version-control.test.integration.fixed-snapshot",
      "kind": "test-suite",
      "path": "tests/integration/fixed-snapshot.integration.test.ts",
      "qaIds": [
        "QA-000001",
        "QA-000007"
      ],
      "localTestIds": [
        "RCM-IT-003",
        "RFD-IT-008"
      ],
      "verifies": [
        "version-control.source.src.fixed.snapshot",
        "version-control.source.src.git.fixed.snapshot.adapter",
        "version-control.source.src.repository.location"
      ]
    },
    {
      "symbolId": "version-control.test.integration.fixed-revision-and-ignore",
      "kind": "test-suite",
      "path": "tests/integration/fixed-revision-and-ignore.integration.test.ts",
      "qaIds": [
        "QA-000007"
      ],
      "localTestIds": [
        "RFD-IT-008"
      ],
      "verifies": [
        "version-control.source.src.fixed.revision",
        "version-control.source.src.git.fixed.revision.adapter",
        "version-control.source.src.git.repository.layout",
        "version-control.source.src.git.repository.local.ignore.adapter",
        "version-control.source.src.repository.local.ignore",
        "version-control.source.src.repository.location"
      ]
    },
    {
      "symbolId": "version-control.source.src.repository.identity.index",
      "kind": "file",
      "path": "src/index.ts",
      "archIds": [
        "ARCH-000002"
      ]
    },
    {
      "symbolId": "version-control.source.src.git.object.reader",
      "kind": "file",
      "path": "src/git/objects.ts",
      "archIds": [
        "ARCH-000002"
      ]
    },
    {
      "symbolId": "version-control.source.src.git.fixed.snapshot.adapter",
      "kind": "file",
      "path": "src/repository/snapshot.ts",
      "archIds": [
        "ARCH-000002"
      ]
    },
    {
      "symbolId": "version-control.source.src.fixed.snapshot",
      "kind": "file",
      "path": "src/repository/snapshot.ts",
      "archIds": [
        "ARCH-000002"
      ]
    },
    {
      "symbolId": "version-control.source.src.git.repository.layout",
      "kind": "file",
      "path": "src/repository/layout.ts",
      "archIds": [
        "ARCH-000002"
      ]
    },
    {
      "symbolId": "version-control.source.src.repository.location",
      "kind": "file",
      "path": "src/repository/location.ts",
      "archIds": [
        "ARCH-000002"
      ]
    },
    {
      "symbolId": "version-control.source.src.git.repository.layout.adapter",
      "kind": "file",
      "path": "src/repository/layout.ts",
      "archIds": [
        "ARCH-000002"
      ]
    },
    {
      "symbolId": "version-control.source.src.git.local.change.set.adapter",
      "kind": "file",
      "path": "src/repository/changes.ts",
      "archIds": [
        "ARCH-000002"
      ]
    },
    {
      "symbolId": "version-control.source.src.checker.observation.index",
      "kind": "file",
      "path": "src/index.ts",
      "archIds": [
        "ARCH-000002"
      ]
    },
    {
      "symbolId": "version-control.source.src.local.change.set",
      "kind": "file",
      "path": "src/repository/changes.ts",
      "archIds": [
        "ARCH-000002"
      ]
    },
    {
      "symbolId": "version-control.source.src.git.fixed.revision.adapter",
      "kind": "file",
      "path": "src/repository/revision.ts",
      "archIds": [
        "ARCH-000002"
      ]
    },
    {
      "symbolId": "version-control.source.src.git.repository.local.ignore.adapter",
      "kind": "file",
      "path": "src/repository/ignore.ts",
      "archIds": [
        "ARCH-000002"
      ]
    },
    {
      "symbolId": "version-control.source.src.fixed.revision",
      "kind": "file",
      "path": "src/repository/revision.ts",
      "archIds": [
        "ARCH-000002"
      ]
    },
    {
      "symbolId": "version-control.source.src.repository.local.ignore",
      "kind": "file",
      "path": "src/repository/ignore.ts",
      "archIds": [
        "ARCH-000002"
      ]
    },
    {
      "symbolId": "version-control.source.src.workspace.merge",
      "kind": "file",
      "path": "src/workspace/merge.ts",
      "archIds": [
        "ARCH-000002",
        "ARCH-000009"
      ]
    }
  ]
}
