{
  "contract": "crdd/reality-symbol-manifest",
  "contractRevision": 1,
  "subsystem": "workbench",
  "symbols": [
    {
      "symbolId": "workbench.test.integration.node-dependency-closure",
      "kind": "test-suite",
      "path": "tests/integration/workbench-node-dependency-closure.contract.test.ts",
      "qaIds": ["QA-000006"],
      "localTestIds": ["ERB-IT-021"],
      "verifies": [
        "workbench.server",
        "workbench.presentation.react-shell",
        "workbench.presentation.browser-client"
      ]
    },
    {
      "symbolId": "workbench.public-api",
      "kind": "module",
      "path": "src/index.ts",
      "archIds": [
        "ARCH-000012"
      ]
    },
    {
      "symbolId": "workbench.server",
      "kind": "file",
      "path": "src/workbench-server.ts",
      "archIds": [
        "ARCH-000005",
        "ARCH-000012",
        "ARCH-000015",
        "ARCH-000017"
      ]
    },
    {
      "symbolId": "workbench.presentation.react-shell",
      "kind": "file",
      "path": "src/presentation/workbench-shell.ts",
      "archIds": [
        "ARCH-000005",
        "ARCH-000012",
        "ARCH-000017"
      ]
    },
    {
      "symbolId": "workbench.presentation.browser-client",
      "kind": "file",
      "path": "client/entry-client.tsx",
      "archIds": [
        "ARCH-000012"
      ]
    },
    {
      "symbolId": "workbench.presentation.browser-application",
      "kind": "file",
      "path": "client/workbench-app.tsx",
      "archIds": [
        "ARCH-000005",
        "ARCH-000012",
        "ARCH-000013",
        "ARCH-000017"
      ]
    },
    {
      "symbolId": "workbench.presentation.client-model",
      "kind": "file",
      "path": "src/presentation/workbench-client-model.ts",
      "archIds": [
        "ARCH-000005",
        "ARCH-000012",
        "ARCH-000013"
      ]
    },
    {
      "symbolId": "workbench.presentation.components",
      "kind": "file",
      "path": "src/presentation/workbench-components.ts",
      "archIds": [
        "ARCH-000012",
        "ARCH-000017"
      ]
    },
    {
      "symbolId": "workbench.application.project-surface",
      "kind": "file",
      "path": "src/project-surface.ts",
      "archIds": [
        "ARCH-000005",
        "ARCH-000012"
      ]
    },
    {
      "symbolId": "workbench.application.credential-administration",
      "kind": "file",
      "path": "src/credential-administration.ts",
      "archIds": [
        "ARCH-000013"
      ]
    },
    {
      "symbolId": "workbench.application.ai-profile-surface",
      "kind": "file",
      "path": "src/ai-profile-surface.ts",
      "archIds": [
        "ARCH-000010",
        "ARCH-000012"
      ]
    },
    {
      "symbolId": "workbench.application.ai-request",
      "kind": "file",
      "path": "src/ai-request.ts",
      "archIds": [
        "ARCH-000010",
        "ARCH-000015"
      ]
    },
    {
      "symbolId": "workbench.application.runtime-activity",
      "kind": "file",
      "path": "src/runtime-activity.ts",
      "archIds": [
        "ARCH-000004",
        "ARCH-000007",
        "ARCH-000012"
      ]
    },
    {
      "symbolId": "workbench.application.owner-artifact-surface",
      "kind": "file",
      "path": "src/owner-artifact-surface.ts",
      "archIds": [
        "ARCH-000005",
        "ARCH-000012",
        "ARCH-000016"
      ]
    },
    {
      "symbolId": "workbench.application.project-plan-surface",
      "kind": "file",
      "path": "src/project-plan-surface.ts",
      "archIds": [
        "ARCH-000005",
        "ARCH-000012"
      ]
    },
    {
      "symbolId": "workbench.application.quality-surface",
      "kind": "file",
      "path": "src/quality-surface.ts",
      "archIds": [
        "ARCH-000005",
        "ARCH-000012"
      ]
    },
    {
      "symbolId": "workbench.adapter.remote-topic-meeting",
      "kind": "file",
      "path": "src/remote-topic-meeting.ts",
      "archIds": [
        "ARCH-000005",
        "ARCH-000006",
        "ARCH-000012",
        "ARCH-000013"
      ]
    },
    {
      "symbolId": "workbench.cli",
      "kind": "file",
      "path": "bin/workbench.ts",
      "archIds": [
        "ARCH-000012"
      ]
    },
    {
      "symbolId": "workbench.test.integration.production-shell",
      "kind": "test-suite",
      "path": "tests/integration/workbench-server.contract.test.ts",
      "qaIds": [
        "QA-000001",
        "QA-000004",
        "QA-000005",
        "QA-000006",
        "QA-000007",
        "QA-000012"
      ],
      "localTestIds": [
        "CPR-IT-006",
        "CPR-IT-008",
        "ERB-IT-021",
        "ERP-IT-001",
        "PPR-IT-002",
        "RCM-IT-005",
        "RFD-IT-005",
        "RFD-IT-013",
        "RFD-IT-014"
      ],
      "verifies": [
        "workbench.server",
        "workbench.presentation.react-shell",
        "workbench.presentation.client-model",
        "workbench.application.credential-administration",
        "workbench.application.ai-profile-surface",
        "workbench.application.ai-request",
        "workbench.application.runtime-activity",
        "workbench.application.owner-artifact-surface",
        "workbench.application.project-plan-surface",
        "workbench.application.quality-surface",
        "workbench.adapter.remote-topic-meeting",
        "project-operation.application.topic-meeting"
      ]
    },
    {
      "symbolId": "workbench.test.integration.project-surface",
      "kind": "test-suite",
      "path": "tests/integration/project-surface.contract.test.ts",
      "qaIds": [
        "QA-000004",
        "QA-000005"
      ],
      "localTestIds": [
        "CPR-IT-008",
        "PPR-IT-019"
      ],
      "verifies": [
        "workbench.application.project-surface"
      ]
    },
    {
      "symbolId": "workbench.test.system.actual-browser-visual",
      "kind": "test-suite",
      "path": "tests/system/workbench-visual.integration.test.ts",
      "qaIds": [
        "QA-000006"
      ],
      "localTestIds": [
        "ERB-ST-022"
      ],
      "verifies": [
        "workbench.server",
        "workbench.presentation.react-shell",
        "workbench.presentation.browser-client",
        "workbench.presentation.browser-application",
        "workbench.presentation.client-model",
        "workbench.presentation.components",
        "visual-preview.application.local-web-visual-verifier"
      ]
    }
  ]
}
