{
  "contract": "crdd/reality-symbol-manifest",
  "contractRevision": 1,
  "subsystem": "ai-runtime",
  "symbols": [
    {
      "symbolId": "ai-runtime.public-api",
      "kind": "module",
      "path": "src/index.ts",
      "archIds": [
        "ARCH-000010"
      ]
    },
    {
      "symbolId": "ai-runtime.catalog",
      "kind": "file",
      "path": "src/catalog.ts",
      "archIds": [
        "ARCH-000010"
      ]
    },
    {
      "symbolId": "ai-runtime.types",
      "kind": "file",
      "path": "src/ai-profile-types.ts",
      "archIds": [
        "ARCH-000010"
      ]
    },
    {
      "symbolId": "ai-runtime.registry",
      "kind": "file",
      "path": "src/registry.ts",
      "archIds": [
        "ARCH-000010"
      ]
    },
    {
      "symbolId": "ai-runtime.catalog-store",
      "kind": "file",
      "path": "src/catalog-store.ts",
      "archIds": [
        "ARCH-000010",
        "ARCH-000011"
      ]
    },
    {
      "symbolId": "ai-runtime.profile-administration",
      "kind": "file",
      "path": "src/profile-administration.ts",
      "archIds": [
        "ARCH-000010"
      ]
    },
    {
      "symbolId": "ai-runtime.test.catalog",
      "kind": "test-suite",
      "path": "tests/ai-profile-catalog.contract.test.ts",
      "qaIds": [
        "QA-000001"
      ],
      "localTestIds": [
        "RCM-UT-001",
        "RCM-UT-002"
      ],
      "verifies": [
        "ai-runtime.catalog",
        "ai-runtime.types",
        "ai-runtime.profile-administration"
      ]
    },
    {
      "symbolId": "ai-runtime.test.catalog-store",
      "kind": "test-suite",
      "path": "tests/integration/ai-profile-catalog-store.integration.test.ts",
      "qaIds": [
        "QA-000001"
      ],
      "localTestIds": [
        "RCM-IT-005"
      ],
      "verifies": [
        "ai-runtime.catalog-store",
        "ai-runtime.catalog"
      ]
    },
    {
      "symbolId": "ai-runtime.test.consumers",
      "kind": "test-suite",
      "path": "tests/integration/ai-profile-consumers.integration.test.ts",
      "qaIds": [
        "QA-000001"
      ],
      "localTestIds": [
        "RCM-IT-005"
      ],
      "verifies": [
        "ai-runtime.catalog",
        "ai-runtime.public-api"
      ]
    }
  ]
}
