{
  "contract": "crdd/reality-symbol-manifest",
  "contractRevision": 1,
  "subsystem": "ai-adapter",
  "symbols": [
    {
      "symbolId": "ai-adapter.codex.advice-distribution",
      "kind": "file",
      "path": "src/codex/advice-distribution.ts",
      "archIds": ["ARCH-000010"]
    },
    {
      "symbolId": "ai-adapter.profile.subscription-status",
      "kind": "file",
      "path": "src/profile/subscription-status.ts",
      "archIds": ["ARCH-000010"]
    },
    {
      "symbolId": "ai-adapter.output.provider-error",
      "kind": "file",
      "path": "src/output/provider-error.ts",
      "archIds": ["ARCH-000010"]
    },
    {
      "symbolId": "ai-adapter.profile.provider-environment",
      "kind": "file",
      "path": "src/profile/environment.ts",
      "archIds": ["ARCH-000010"]
    },
    {
      "symbolId": "ai-adapter.profile.profile-execution",
      "kind": "file",
      "path": "src/profile/execution-identity.ts",
      "archIds": ["ARCH-000010"]
    },
    {
      "symbolId": "ai-adapter.output.task-envelope",
      "kind": "file",
      "path": "src/output/task-envelope.ts",
      "archIds": ["ARCH-000015"]
    },
    {
      "symbolId": "ai-adapter.profile.eligibility",
      "kind": "file",
      "path": "src/profile/eligibility.ts",
      "archIds": ["ARCH-000010"]
    },
    {
      "symbolId": "ai-adapter.codex.authentication",
      "kind": "file",
      "path": "src/codex/authentication.ts",
      "archIds": ["ARCH-000010"]
    },
    {
      "symbolId": "ai-adapter.output.unambiguous-json-document",
      "kind": "file",
      "path": "src/output/unambiguous-json-document.ts",
      "archIds": ["ARCH-000015"]
    },
    {
      "symbolId": "coordinator.source.src.security.provider.model.profile.runtime",
      "kind": "file",
      "path": "src/profile/model.ts",
      "archIds": ["ARCH-000010"]
    },
    {
      "symbolId": "ai-adapter.authentication-policy",
      "kind": "file",
      "path": "src/profile/authentication-policy.ts",
      "archIds": ["ARCH-000010"]
    },
    {
      "symbolId": "ai-adapter.claude.authentication",
      "kind": "file",
      "path": "src/claude/authentication.ts",
      "archIds": ["ARCH-000010"]
    },
    {
      "symbolId": "coordinator.source.src.security.workbench.ai.advice.provider.command",
      "kind": "file",
      "path": "src/advice/provider-command.ts",
      "archIds": [
        "ARCH-000010",
        "ARCH-000015"
      ]
    },
    {
      "symbolId": "coordinator.source.src.security.workbench.ai.advice.provider.output",
      "kind": "file",
      "path": "src/advice/provider-output.ts",
      "archIds": [
        "ARCH-000015"
      ]
    },
    {
      "symbolId": "coordinator.source.src.security.claude.execution.plan",
      "kind": "file",
      "path": "src/claude/execution-plan.ts",
      "archIds": [
        "ARCH-000010"
      ]
    },
    {
      "symbolId": "coordinator.source.src.security.codex.execution.plan",
      "kind": "file",
      "path": "src/codex/execution-plan.ts",
      "archIds": [
        "ARCH-000010"
      ]
    },
    {
      "symbolId": "coordinator.source.src.security.claude.structured.result",
      "kind": "file",
      "path": "src/claude/structured-result.ts",
      "archIds": [
        "ARCH-000015"
      ]
    },
    {
      "symbolId": "coordinator.source.src.security.codex.structured.result",
      "kind": "file",
      "path": "src/codex/structured-result.ts",
      "archIds": [
        "ARCH-000015"
      ]
    },
    {
      "symbolId": "coordinator.source.src.security.provider.billing.policy",
      "kind": "file",
      "path": "src/profile/billing-policy.ts",
      "archIds": [
        "ARCH-000010"
      ]
    },
    {
      "symbolId": "ai-runtime.public-api",
      "kind": "module",
      "path": "src/index.ts",
      "archIds": [
        "ARCH-000010"
      ]
    },
    {
      "symbolId": "ai-runtime.catalog",
      "kind": "file",
      "path": "src/catalog/resolve.ts",
      "archIds": [
        "ARCH-000010"
      ]
    },
    {
      "symbolId": "ai-runtime.types",
      "kind": "file",
      "path": "src/catalog/types.ts",
      "archIds": [
        "ARCH-000010"
      ]
    },
    {
      "symbolId": "ai-runtime.registry",
      "kind": "file",
      "path": "src/profile/registry.ts",
      "archIds": [
        "ARCH-000010"
      ]
    },
    {
      "symbolId": "ai-runtime.catalog-store",
      "kind": "file",
      "path": "src/profile/store.ts",
      "archIds": [
        "ARCH-000010",
        "ARCH-000011"
      ]
    },
    {
      "symbolId": "ai-runtime.profile-administration",
      "kind": "file",
      "path": "src/profile/administration.ts",
      "archIds": [
        "ARCH-000010"
      ]
    },
    {
      "symbolId": "ai-runtime.test.catalog",
      "kind": "test-suite",
      "path": "tests/unit/catalog/resolve.contract.test.ts",
      "qaIds": [
        "QA-000001"
      ],
      "localTestIds": [
        "RCM-UT-001",
        "RCM-UT-002"
      ],
      "verifies": [
        "ai-runtime.catalog",
        "ai-runtime.types",
        "ai-runtime.profile-administration"
      ]
    },
    {
      "symbolId": "ai-runtime.test.catalog-store",
      "kind": "test-suite",
      "path": "tests/integration/ai-profile-catalog-store.integration.test.ts",
      "qaIds": [
        "QA-000001"
      ],
      "localTestIds": [
        "RCM-IT-005"
      ],
      "verifies": [
        "ai-runtime.catalog-store",
        "ai-runtime.catalog"
      ]
    },
    {
      "symbolId": "ai-runtime.test.consumers",
      "kind": "test-suite",
      "path": "tests/integration/ai-profile-consumers.integration.test.ts",
      "qaIds": [
        "QA-000001"
      ],
      "localTestIds": [
        "RCM-IT-005"
      ],
      "verifies": [
        "ai-runtime.catalog",
        "ai-runtime.public-api"
      ]
    },
    {
      "symbolId": "coordinator.test.unit.claude-structured-result",
      "kind": "test-suite",
      "path": "tests/unit/claude/structured-result.contract.test.ts",
      "qaIds": [
        "QA-000006"
      ],
      "localTestIds": [
        "ERB-UT-032"
      ],
      "verifies": [
        "coordinator.source.src.security.claude.structured.result",
        "ai-adapter.output.unambiguous-json-document"
      ]
    },
    {
      "symbolId": "coordinator.test.unit.codex-structured-result",
      "kind": "test-suite",
      "path": "tests/unit/codex/structured-result.contract.test.ts",
      "qaIds": [
        "QA-000006"
      ],
      "localTestIds": [
        "ERB-UT-032"
      ],
      "verifies": [
        "coordinator.source.src.security.codex.structured.result"
      ]
    },
    {
      "symbolId": "coordinator.test.unit.provider-billing-policy",
      "kind": "test-suite",
      "path": "tests/unit/profile/billing-policy.contract.test.ts",
      "qaIds": [
        "QA-000006"
      ],
      "localTestIds": [
        "ERB-UT-033"
      ],
      "verifies": [
        "coordinator.source.src.security.provider.billing.policy"
      ]
    }
  ]
}
