{
  "contract": "crdd/reality-symbol-manifest",
  "contractRevision": 1,
  "subsystem": "access-management",
  "symbols": [
    { "symbolId": "access-management.public-api", "kind": "module", "path": "src/index.ts", "archIds": ["ARCH-000013"] },
    { "symbolId": "access-management.credential-token-material", "kind": "file", "path": "src/credential/token-material.ts", "archIds": ["ARCH-000013"] },
    { "symbolId": "access-management.credential-authentication", "kind": "file", "path": "src/credential/authentication.ts", "archIds": ["ARCH-000013"] },
    { "symbolId": "access-management.credential-presentation", "kind": "file", "path": "src/credential/presentation.ts", "archIds": ["ARCH-000013"] },
    { "symbolId": "access-management.credential-initial-connection", "kind": "file", "path": "src/credential/initial-connection.ts", "archIds": ["ARCH-000013"] },
    { "symbolId": "access-management.initialization-host-state", "kind": "file", "path": "src/initialization/host-state.ts", "archIds": ["ARCH-000013"] },
    { "symbolId": "access-management.test.integration.initial-connection", "kind": "test-suite", "path": "tests/integration/credential/initial-connection.contract.test.ts", "qaIds": ["QA-000007"], "localTestIds": ["RFD-IT-024", "RFD-IT-025"], "verifies": ["access-management.public-api", "access-management.credential-initial-connection", "access-management.credential-authentication", "access-management.state-file-store", "access-management.state-parse", "access-management.credential-presentation"] },
    { "symbolId": "access-management.current-access", "kind": "file", "path": "src/access/current-access.ts", "archIds": ["ARCH-000013"] },
    { "symbolId": "access-management.profile-management", "kind": "file", "path": "src/access/profile-management.ts", "archIds": ["ARCH-000013"] },
    { "symbolId": "access-management.repository-access", "kind": "file", "path": "src/access/repository-access.ts", "archIds": ["ARCH-000013"] },
    { "symbolId": "access-management.management-read-state", "kind": "file", "path": "src/management/read-state.ts", "archIds": ["ARCH-000013"] },
    { "symbolId": "access-management.user-role-management", "kind": "file", "path": "src/management/user-role.ts", "archIds": ["ARCH-000013"] },
    { "symbolId": "access-management.repository-exposure-management", "kind": "file", "path": "src/management/repository-exposure.ts", "archIds": ["ARCH-000013"] },
    { "symbolId": "access-management.workspace-range", "kind": "file", "path": "src/access/workspace-range.ts", "archIds": ["ARCH-000013"] },
    { "symbolId": "access-management.repository-binding", "kind": "file", "path": "src/state/repository-binding.ts", "archIds": ["ARCH-000013"] },
    { "symbolId": "access-management.test.integration.credential-token-material", "kind": "test-suite", "path": "tests/integration/credential/token-material.contract.test.ts", "qaIds": ["QA-000007"], "localTestIds": ["RFD-IT-017", "RFD-IT-018"], "verifies": ["access-management.public-api", "access-management.credential-token-material"] },
    { "symbolId": "access-management.state-file-store", "kind": "file", "path": "src/state/file-store.ts", "archIds": ["ARCH-000013"] },
    { "symbolId": "access-management.test.integration.state-file-store", "kind": "test-suite", "path": "tests/integration/state/file-store.contract.test.ts", "qaIds": ["QA-000007"], "localTestIds": ["RFD-IT-001", "RFD-IT-002", "RFD-IT-013", "RFD-IT-017", "RFD-IT-018", "RFD-IT-019", "RFD-IT-021", "RFD-IT-024", "RFD-IT-025"], "verifies": ["access-management.public-api", "access-management.state-file-store", "access-management.state-parse", "access-management.initialization-host-state", "access-management.credential-authentication", "access-management.credential-presentation", "access-management.profile-management", "access-management.current-access", "access-management.repository-access", "access-management.management-read-state", "access-management.user-role-management", "access-management.repository-exposure-management", "access-management.workspace-range", "access-management.repository-binding"] },
    { "symbolId": "access-management.state-parse", "kind": "file", "path": "src/state/parse.ts", "archIds": ["ARCH-000013"] },
    { "symbolId": "access-management.test.unit.state-parse", "kind": "test-suite", "path": "tests/unit/state/parse.contract.test.ts", "qaIds": ["QA-000007"], "localTestIds": ["RFD-UT-028"], "verifies": ["access-management.public-api", "access-management.state-parse"] },
    { "symbolId": "access-management.management-permission", "kind": "file", "path": "src/access/management-permission.ts", "archIds": ["ARCH-000013"] },
    { "symbolId": "access-management.test.unit.management-permission", "kind": "test-suite", "path": "tests/unit/access/management-permission.contract.test.ts", "qaIds": ["QA-000007"], "localTestIds": ["RFD-UT-020"], "verifies": ["access-management.public-api", "access-management.management-permission"] },
    { "symbolId": "access-management.initialization-state-evaluation", "kind": "file", "path": "src/initialization/state-evaluation.ts", "archIds": ["ARCH-000013"] },
    { "symbolId": "access-management.test.unit.initialization-state-evaluation", "kind": "test-suite", "path": "tests/unit/initialization/state-evaluation.contract.test.ts", "qaIds": ["QA-000007"], "localTestIds": ["RFD-UT-023"], "verifies": ["access-management.public-api", "access-management.initialization-state-evaluation"] }
  ]
}
